{
  "task_id": "T03",
  "reviewer_kind": "codex_review",
  "review_mode": "blocking",
  "model": "repo_policy_gate",
  "risk": "medium",
  "findings": [
    {
      "severity": "medium",
      "category": "review_gate",
      "title": "Repo-side blocking review required before downstream use",
      "detail": "The repo-side review gate derived blocking reasons before downstream use and wrote a machine-readable receipt. This does not imply that a live heterogeneous reviewer already ran.",
      "suggested_fix": "Produce a downstream review decision or explicit operator disposition before downstream use."
    }
  ],
  "blocking_reasons": [
    "risk_level=medium",
    "write_access=true"
  ],
  "missing_tests": [],
  "recommended_action": "revise",
  "source_evidence_refs": [
    ".ai/runs/<run_id>/T02/result.json",
    ".ai/runs/<run_id>/T02/dispatch_state.json",
    ".ai/runs/<run_id>/T02/verification_summary.json"
  ]
}
